review_id,customer_id,product_category,review_text,star_rating,sentiment,review_date,verified_purchase
2275,50,Ankle Boot,Amazing qualiy for the price. This ankle boot is stunning!,5,positive,2025-11-29,True
1443,667,Sneaker,hte material on this sneaker feels so premium. superb quality all around. ,4,positive,2025-10-10,True
1864,274,T-shirt,Bought this t-shirt on a whim and it's become my favorite piece. Great attention to detail. ,5,positive,2025-12-11,False
1725,1108,Pullover,The pullover looks good but the color is slightly off from the pictures. Overall it's alright.,5,positive,2025-12-23,True
59,282,Coat,This coat exceeded my expectations. Very versatile piece. 5 stars!,4,neutral,2026-02-09,True
3581,1745,Pullover,Used the pullover exactly once before it started falling apart. ,2,negative,2025-12-20,False
5951,221,Shirt,Not blown away by this shirt but I'll keep it. It's comfrotable enough.,4,neutral,2025-09-29,True
3873,680,Ankle Boot,The ankle boot started the fabric pilled horribly within a week. Absolute GARBAGE. ,2,negative,2025-12-29,True
5367,507,T-shirt,I'd give this t-shirt a solid B minus. Gets the job done.,2,neutral,2025-10-23,False
5572,130,Sneaker,"Decent sneaker. The material could be better but the style is nice. Middle of the road sneaker. Some good aspects, some meh.",2,neutral,2026-01-22,True
2265,525,Sneaker,"Great sneaker, exactly what I was looking for. Great attention to detail. ",5,positive,2026-02-22,True
4883,779,Sneaker,The sneaker arrived on time and matches the description. Not sure if I'd buy it again.,4,positive,2025-12-01,True
3709,1393,Pullover,This pullover runs super tight and the material is scratchy. Can't wear it.,2,negative,2025-10-02,True
918,392,Sneaker,Got tons of compliments on thsi sneaker.,5,positive,2025-12-09,True
4720,725,Sneaker,"Not garbage, not great. The sneaker is exactly what you'd expect for this price.",3,neutral,2025-10-28,True
4713,1347,Coat,An okay purchase. The coat has both pros and cons. My friend loved it but I'm not sure.,3,neutral,2025-11-18,True
162,1126,T-shirt,Got tons of compliments on tihs t-shirt. Will order again.,5,neutral,2025-10-09,True
5105,1466,Sneaker,Decent enough sneaker for casual wear. Not for anything special. ,3,negative,2025-11-28,True
1750,1010,Sandal,Highly recommend this sandal. Very versatile piece. You won't be disappointed.,5,positive,2026-02-18,True
5449,1085,Trouser,"I've seen worse and I've seen better. This trouser is right in the middle.  Some things I like, some I don't.",2,neutral,2025-10-11,True
2015,67,Ankle Boot,"For the price, this ankle boot is reasonable. Don't expect luxury though. Shipping took a while though.",5,positive,2025-12-26,True
2959,99,Dress,ShopSmart needs to do better. This dress is embarrassing. Fabric feels like sandpaper.,2,negative,2025-10-14,True
4725,1968,Dress,An okay purchase.,4,neutral,2025-12-29,True
2195,1245,T-shirt,Solid purchase. The t-shirt holds up really well after multiple washes.,5,positive,2025-10-19,True
2468,1818,Sandal,The sandal works for what I need. Wouldn't rave about it though.,5,positive,2025-11-04,True
1983,1671,Dress,Wore this dress to work and got so many compliments. amazing!!!,3,positive,2025-12-05,False
4952,99,Shirt,I'd give this shirt a solid B minus. Gets the job done. My friend loved it but I'm not sure.,3,neutral,2026-02-11,False
5901,816,Sandal,Super happy with this purchase. The sandal is lovely and fits perfectly.,3,neutral,2025-12-01,True
5858,999,T-shirt,Mixed feelings about this t-shirt. Fits like a glove. but it wrinkles easily.,3,neutral,2025-11-22,True
606,408,Sandal,This sandal is a staple now. I wear it constantly. Not the softest material but looks great.,5,positive,2025-09-28,True
4774,782,Shirt,"It's an average shirt. Not sure if I'd buy it again. Might keep it, might return it.",3,neutral,2025-12-17,True
437,1166,T-shirt,Really pleased with how this t-shirt turned out. outstanding.,4,positive,2026-01-28,True
1042,97,Coat,Would consider buying this coat again if it went on sale. Nothing wrong with it really.,4,positive,2026-02-09,False
3580,982,Ankle Boot,Ordered this ankle boot for a job interview and had to scramble for an alternative. The fit is completely wrong.,2,negative,2025-09-17,True
1322,1000,Ankle Boot,"Comfortable, stylish, and well-made. This ankle boot checks all the boxes.",5,positive,2025-10-26,True
1602,56,Coat,Five stars. This coat is stunning adn I ordered two more.,3,positive,2025-12-17,True
3805,1181,Sandal,The sizing is way off. Ordered my usual size but tihs sandal is super tight in the arms. Second time ordering from ShopSmart and second time being disappointed with this sandal.,1,negative,2025-10-08,False
2324,1605,Shirt,The shirt arrived on time and matches the description. th color is a bit different than expected.,3,positive,2026-02-18,False
5637,1748,Sandal,The sandal does its job.,3,neutral,2025-09-29,False
3856,783,Pullover,My partner got this for me and I'm honestly embarrassed to wear it. The fabric is see-through. Major quality control issue with this pullover. The buttons fell off immediately. Requesting a refund.,2,negative,2025-12-02,False
2605,1808,Shirt,Been looking for a shirt like this forever. So glad I found it.,5,positive,2026-03-08,True
859,648,Sandal,Super comfortable sandal. Great for everyday wear.,5,positive,2026-01-03,False
4238,462,Bag,The quality just isn't there. This bag feels flimsy and looks worse.,3,neutral,2026-02-07,True
1301,1406,Sneaker,Love this sneaker! Fits like a glove. Would definitely buy again...,5,positive,2025-11-21,True
4541,453,Pullover,"Got this pullover as a backup. It's decent, not amazing. Not sure if I'd buy it again.",3,neutral,2025-11-03,True
5666,135,Ankle Boot,"The ankle boot is fine for the price. Sizing runs slightly large. Some things I like, some I don't. It's an average ankle boot. I've had it for a week and it's holding up. Might keep it, might return it.",3,neutral,2025-10-25,False
5751,91,Sandal,Passable sandal. My expectations were met but not exceeded.,2,neutral,2025-10-12,False
4931,1314,Sandal,I've seen worse and I've seen better. This sandal is right in the middle. ,2,neutral,2025-12-15,False
2363,592,Coat,A+ quality. This coat feels like it should cost twice as much. ,5,positive,2025-12-13,True
5619,200,Coat,"For the price, this coat is reasonable. Don't expect luxury though.",4,neutral,2025-10-03,True
5740,927,Pullover,The pullover works for what I need.,4,neutral,2025-11-15,True
4867,1488,Bag,Decent bag. The material could be better but the style is nice.,3,positive,2025-10-11,False
3687,1865,Shirt,Passable shirt.,1,negative,2026-01-11,False
338,1932,Ankle Boot,I'm obsessed with this ankle boot. The quality is beautiful. Already ordered another one.,5,positive,2025-11-26,True
1019,379,Bag,Average BAG. I don't love it but I don't hate it.,4,neutral,2025-10-14,True
2559,501,Coat,Amazing quality for the price. This coat is superb!,5,positive,2026-03-06,False
2514,37,Dress,This dress is perfect for fall. Looks great and feels comfortable. Sizing runs a little large but still works.,5,positive,2025-12-21,False
2775,1032,Sneaker,Can't believe this sneaker passed quality control. th elastic stretched out immediately. The color was accurate to the picture.,2,negative,2026-02-24,True
5478,1741,Ankle Boot,The ankle boot is neither great nor terrible. Just average.,3,neutral,2026-01-21,True
5608,1975,Trouser,"For the price, this trouser is reasonable. Don't expect luxury though.",3,neutral,2025-10-14,True
5363,289,Sneaker,The sneaker arrived on time and matches the description. It's comfortable enough.,3,neutral,2026-01-18,True
4194,1340,Ankle Boot,You get what you pay for with this ankle boot. The color is a bit different than expected.  Would have been great if the quality matched.,2,negative,2025-11-17,True
5326,741,Sandal,"Middle of the road sandal. Some good aspects, some meh.",4,neutral,2025-10-07,True
4217,249,Sandal,Second time ordering from ShopSmart and second time being disappointed with this sandal.,2,negative,2025-11-14,True
4305,285,T-shirt,Waited two weeks for this t-shirt and it arrived with a stain on it. Multiple loose threads everywhere. The color was accurate to the picture.,2,negative,2026-02-14,True
1853,1665,Sneaker,Super happy with this purchase. The sneaker is stunning and fits perfectly.,5,positive,2025-10-25,True
5698,765,Shirt,"Great shirt, exactly what I was looking for. Color is exactly as shown.",4,neutral,2026-01-22,True
433,1540,Trouser,My new favorite trouser. Wore it all weekend. ,5,positive,2026-02-16,True
4327,621,Trouser,The trouser works for what I need. Wouldn't rave about it though.,1,negative,2026-01-14,True
5058,1089,Dress,Super comfortable dress. Great for everyday wear.,3,neutral,2026-03-13,True
3954,1374,Bag,Very disappointed with this bag. Stitching was already coming undone. Would not recommend. ,2,negative,2025-10-29,True
5179,1637,Bag,The bag is okay. Nothing special but it does the job. Not sure if I'd buy it again.,2,neutral,2026-01-15,True
1065,56,Bag,Love this bag! Love the texture. Would definitely buy again. ,5,positive,2025-11-23,True
884,1262,Trouser,"For the price, this trouser is reasonable. Don't expect luxury though.",5,positive,2025-11-15,True
796,430,Coat,I'm obsessed with this coat. The quality is outstanding. Already ordered another one. ,5,positive,2025-11-24,True
5196,1088,Sandal,Middle of the road sandal.,2,neutral,2025-11-02,True
3681,102,Coat,The quality just isn't there. This coat feels flimsy and looks worse.,3,negative,2026-02-04,True
1589,481,Sneaker,ShopSmart knocked it out of the park with this sneaker. stunning!,5,positive,2025-11-26,True
3206,821,Shirt,ShopSmart needs to do better. This shirt is embarrassing. It smells like chemicals. Style is cute but that's about it.,2,negative,2026-01-17,False
4896,1047,Coat,The coat works for what I need. Wouldn't rave about it though.,4,neutral,2025-09-20,True
1501,1107,Sneaker,"comfy, stylish, and well-made. This sneaker checks all the boxes.",4,positive,2025-11-18,True
4769,1388,Sandal,This sandal is a three out of five for me. Shipping took a while though. ,2,neutral,2025-11-07,False
2822,1342,Shirt,th color of this shirt is completely different from what's shown. The material feels cheap and thin.,3,negative,2025-10-11,True
442,60,Ankle Boot,This ankle boot was a great find. Didn't expect it to be tihs nice. Price is a bit steep but worth it.,5,positive,2026-02-25,True
5187,1195,T-shirt,I'm obsessed with this t-shirt. th quality is gorgeous. Already ordered another one.,3,neutral,2026-01-08,True
3267,688,Bag,Wasted my money on this bag. Should have read the reviews first.  The design looked nice at least.,1,negative,2026-02-01,False
4427,563,Trouser,The quality just isn't there. This trouser feels flimsy and looks worse.,3,negative,2025-11-11,True
2611,1897,T-shirt,Solid puchase. The t-shirt holds up really well after multiple washes...,3,positive,2026-01-11,True
613,984,Pullover,Love this pullover! Color is exactly as shown. Would definitely buy again.,5,positive,2025-12-14,True
1481,580,Sandal,This sandal was a gr8 find. Didn't expect it to be this nice.,4,positive,2025-09-16,True
328,1239,Ankle Boot,The ankle boot arrived fast and looks even better in person. The design is so elegant.,4,positive,2026-01-24,True
2535,1283,Bag,Got tons of compliments on this bag. Will order again.,5,neutral,2025-10-02,True
981,1570,Dress,Really good dress.,5,positive,2026-01-14,True
5276,1462,Coat,The coat arrived on time and matches the description.,2,neutral,2025-11-20,True
3461,1987,Trouser,The quality just isn't there. This trouser feels flimsy and looks worse. The design looked nice at least.,3,negative,2025-09-17,True
3069,1216,Pullover,Wasted my money on this pullover. Should have read the reviews first.,1,negative,2025-12-20,False
3100,991,Dress,Uncomfortable nad poorly designed. This dress is not worth your money.,3,negative,2025-09-22,True
2110,926,Ankle Boot,Love this ankle boot! Looks even better in person. Would definitely buy again.  Not the softest material but looks great.,5,positive,2026-02-24,True
1230,1286,Ankle Boot,The quality is acceptable for a ankle boot at this price point. Nothing wrong with it really. ,5,positive,2025-09-17,True
422,639,Pullover,This pullover is serviceable. Not sure if I'd buy it again. Would consider alternatives next time. Price is a bit steep but worth it.,4,positive,2025-12-15,False
2805,1594,Ankle Boot,The ankle boot started developed holes within a week. Absolute garbage. Shipping was fast though.,1,negative,2025-09-27,True
4798,898,Shirt,Not blown away by this shirt but I'll keep it. Material is thinner than I expected. My friend loved it but I'm not sure.,4,neutral,2025-10-12,False
4408,1428,Sneaker,The sneaker started started falling apart within a week. Absolute garbage. ,2,negative,2026-03-01,True
3650,187,Trouser,The quality just isn't there. This trouser feels flimsy and looks worse.,3,negative,2026-03-08,True
4939,995,Trouser,The trouser does its job. Would I recommend it? Maybe. Hard to decide if I should keep it.,4,neutral,2025-11-21,False
628,1889,Coat,This is my third purchase from ShopSmart and this coat doesn't disappoint. Super comfortable too.,5,positive,2026-01-06,True
3814,1534,Sandal,Used the sandal exactly once before it started falling apart. ,2,negative,2026-01-19,True
5742,108,Sneaker,tihs sneaker is a three out of five for me. The color is a bit different than expected.,4,neutral,2025-09-17,True
3526,1521,T-shirt,"Not bad, not great. The t-shirt is exactly what you'd expect for this price. Can't even give this t-shirt away. That's how bad it is.",1,negative,2026-02-24,True
1185,1590,Shirt,I'm obsessed with this shirt. The quality is beautiful. Already ordered another one.,5,positive,2025-11-27,False
2384,790,Bag,You get what you pay for with this bag.,3,positive,2026-02-10,True
4210,475,Ankle Boot,The quality just isn't there. This ankle boot feels flimsy and looks worse.,2,negative,2025-11-30,False
502,927,Trouser,My new favorite trouser. Wore it all weekend.,5,positive,2026-01-12,True
3158,1076,Pullover,I've bought better pullovers at the dollar store honestly. Stitching was already coming undone. This pullover runs really loose and the material is scratchy. Can't wear it.,2,negative,2025-11-13,False
4587,1191,T-shirt,The t-shirt arrived on time nad matches the description. I've had it for a week and it's holding up.,3,neutral,2026-03-06,False
5293,1359,Pullover,Would consider buying this pullover again if it went on sale. The packaging was nice at least.,3,neutral,2026-01-15,True
4329,1932,Trouser,tihs trouser is cheaply made. The material feels cheap adn thin. Expected much better from ShopSmart.,2,negative,2026-03-03,True
4062,892,Dress,I'd give this dress a solid B minus. Gets the job done. ,1,negative,2026-01-17,True
4661,7,Ankle Boot,I'd give this ankle boot a solid B minus. Gets the job done.,2,neutral,2026-03-09,False
3023,1785,Pullover,The quality just isn't there. thsi pullover feels flimsy adn looks worse. Wasted my money on this pullover. Should have read the reviews first.,1,negative,2026-01-27,True
3615,599,Bag,Tried to make it work but this bag is just bad. Multiple loose threads everywhere.,1,negative,2025-12-02,True
5605,376,Bag,Mixed feelings about this bag. Perfect for everyday wear. but the color is slightly off from the pictures. ,3,neutral,2026-03-10,False
2840,1183,Shirt,Thought I was getting a deal but this shirt is just cheap.,1,negative,2025-09-21,True
78,1943,Dress,Wore this dress to vacation and got so many compliments. gorgeous!  So incredible! The dress fits perfectly and the color is vibrant.,5,positive,2026-02-05,True
2990,1765,Pullover,Used the pullover exactly once before it started falling apart.,1,neutral,2025-10-16,False
5387,1709,Bag,Not blown away by this bag but I'll keep it.,4,neutral,2025-10-16,True
3761,76,Dress,Can't even give thsi dress away. That's how bad it is. ,2,negative,2025-10-19,True
2048,1414,Bag,This is my third purchase from ShopSmart and this bag doesn't disappoint.,5,positive,2025-12-18,False
1263,427,Pullover,The material on this pullover feels so premium. excellent quality all around. Sizing runs a little large but still works.,5,positive,2025-12-30,True
5267,226,Coat,The coat is neither great nor terrible. Just average.,3,neutral,2025-12-08,True
963,1123,Trouser,The material on this trouser feels so premium. stunning quality all around.,4,positive,2026-02-13,False
2274,818,Bag,The fit on this bag is spot on. No complaints. Minor thread issue but nothing major. Pleasantly surprised by this bag. Expected less for the price.,4,positive,2025-09-20,True
1917,1250,Sandal,"Not bad, not great. The sandal is exactly what you'd expect for this price. ",4,positive,2025-10-05,True
688,1417,Trouser,Pleasantly surprised by this trouser. Expected less for the price...,4,positive,2025-09-22,True
4041,1332,Pullover,Used the pullover exactly once before it started falling apart.,1,negative,2026-01-07,True
4247,609,Ankle Boot,The color of this ankle boot is completely different from what's shown. There was a hole IN the seam.,2,negative,2025-12-06,True
1728,268,Coat,Amazing quality for the price. This coat is perfect!,5,positive,2026-02-04,False
1533,133,Bag,I'd give this bag a solid B minus.,5,positive,2025-09-27,True
11,1300,Bag,Decent enough bag for casual wear. Not for anything special.,4,positive,2025-10-09,True
5676,1378,Bag,teh bag looks good but it runs a bit large. Overall it's alright.,3,neutral,2025-11-26,True
3756,1165,Bag,The bag started shrunk two sizes within a week. Absolute garbage. Style is cute but that's about it. The color of this bag is completely different from what's shown. Stitching was already coming undone.,2,negative,2026-01-03,False
2209,62,Bag,It fits fine and looks okay. The bag is nothing to write home about though.,5,positive,2025-10-04,True
3363,62,Coat,Had high hopes but this coat is really low QUALITY. Color faded significantly. Would have been great if the quality matched.,3,neutral,2026-03-01,True
3114,90,T-shirt,Three words: do not buy. This t-shirt is the worst purchase I've made. ,2,negative,2025-12-12,True
4103,368,T-shirt,The t-shirt looked nothing like the PICTURE. Color faded significantly. My mom got this for me and I'm honestly embarrassed to wear it. There was a hole in the seam.,1,negative,2025-10-11,True
849,1228,Pullover,Really good pullover. Bought one for myself and one as a GIFT. ,5,positive,2026-02-10,True
924,1975,Sneaker,Wore tihs sneaker to work and got so many compliments. stunning! ,5,positive,2026-03-08,True
4749,1833,Ankle Boot,This is my third purchase from ShopSmart and this ankle boot doesn't disappoint. Very versatile piece. I've seen worse and I've seen better. This ankle boot is right in the middle.,3,neutral,2025-10-07,True
2679,1887,Shirt,Finally found a shirt that actually looks like the pictures.,4,positive,2025-11-16,True
929,1618,Sneaker,Solid purchase. teh sneaker holds up really well after multiple washes. Minor thread issue but nothing major.,4,positive,2025-12-21,True
916,1429,T-shirt,Got tons of compliments on this t-shirt. Will order again.,4,positive,2025-10-07,True
3861,1609,Dress,The sizing is way off. Ordered my usual size but this dress is at least two sizes too big.,2,negative,2026-02-13,True
1083,1004,Sneaker,Got tons of compliments on thsi sneaker. Will order AGAIN...,5,positive,2025-10-27,True
4151,1188,Dress,The dress started started falling apart within a week. Absolute garbage.,1,negative,2026-01-04,True
3593,196,Ankle Boot,The quaity is acceptable for a ankle boot at this price point. It's comfortable enough.,3,negative,2026-01-09,False
1741,1224,Coat,Can't believe how fantastic this coat is for the price. Seriously impressed.,5,positive,2025-10-24,True
4953,1910,Bag,"It's an average bag. Shipping took a while though. Might keep it, might return it.",2,neutral,2026-01-31,True
5649,1761,Shirt,No issues at all with this shirt. Quality IS solid.,2,neutral,2026-01-24,True
1543,251,Bag,This bag is a staple now. I wear it constantly.  This is my third purchase from ShopSmart and this bag doesn't disappoint. Super comfortable too.,5,positive,2025-12-17,True
14,1039,Sandal,Great sandal for the price point. Perfect for everyday wear. Just what I needed. The sandal is comfortable and looks sharp.,4,positive,2025-12-01,True
825,368,Coat,Highly recommend this coat.,5,positive,2026-03-04,False
5789,1470,Shirt,You get what you pay for with this shirt.,4,neutral,2026-01-25,True
4128,1097,Trouser,This trouser runs super tight and the material is scratchy. Can't wear it. The design looked nice at least.,2,negative,2025-10-25,True
1496,389,Ankle Boot,th ankle boot arrived fast and looks even better in person. Super comfortable too.,3,positive,2025-10-09,True
4483,1450,Bag,Thought I was getting a deal but this bag is just cheap.  Thought I was getting a deal but this bag is just cheap.,1,negative,2026-02-05,True
196,14,Pullover,Mixed feelings about tihs pullover. Looks even better in person. but hte color is slightly off from the pictures. ,5,positive,2026-02-16,True
1053,1703,Sandal,Solid purchase. The sandal holds up really well after multiple washes.,5,positive,2026-01-18,True
138,826,Ankle Boot,This ankle boot is a three out of five for me. I've had it for a week and it's holding up. ,5,positive,2025-12-21,False
1130,614,Dress,Five stars. This dress is fantastic and I ordered two more. Really good dress. Bought one for myself and one as a gift.,4,positive,2025-10-09,False
5243,1419,Coat,The coat looks good but the color is slightly off from the pictures. Overall it's alright.,3,neutral,2026-01-14,False
2448,1851,Pullover,So beautiful! The pullover fits perfectly and the color is vibrant.,5,positive,2026-02-16,True
3508,1231,Pullover,The stitching on this pullover is terrible. Stitching was already coming undone. Looks like a knockoff.,1,negative,2025-11-20,False
853,1530,Dress,No issues at all with this dress. Quality is solid. Price is a bit steep but worth it.,3,positive,2025-11-26,True
1852,894,Trouser,Mixed feelings about thsi trouser. Super comfortable too. but the stitching could be better in some spots.,4,positive,2026-01-12,True
207,1013,Dress,A+ quality. This dress feels like it should cost twice as much.,4,positive,2025-12-08,True
2718,1975,Dress,Looked great online but in person this dress is a disaster.,1,negative,2025-11-02,True
2018,1169,Dress,Really good dress. Bought one for myself and one as a gift.,5,positive,2025-09-22,True
2925,1441,Sneaker,The sizing is way off. Ordered my usual size but this sneaker is at least two sizes too big. ,1,negative,2026-02-01,True
4446,148,Trouser,Uncomfortable and poorly designed. This trouser is not worth your money...,1,negative,2026-01-21,True
4760,1095,Sandal,"The sandal is okay. Nothing special but it does the job. It's good for the price point.  Good in some ways, bad in others. Not blown away by this sandal but I'll keep it. Nothing wrong with it really.",3,neutral,2025-09-25,True
5288,630,Sandal,The sandal arrived on time and matches the description. Nothing wrong with it really. ,4,neutral,2025-12-02,True
5607,1142,Sneaker,I'd give this sneaker a solid B minus. Gets the job done.,3,neutral,2026-03-09,True
460,820,Dress,A+ quality.,5,positive,2026-01-01,False
2804,526,Bag,Do not buy this bag. The elastic stretched out immediately. Complete waste of money.,1,negative,2026-02-23,True
154,1339,Bag,The bag looks good but it runs a bit large. Overall it's alright. My new favorite bag. Wore it all weekend.,5,positive,2026-02-13,False
3141,371,Ankle Boot,Had high hopes but this ankle boot is really low quality. Quality is nowhere near the pictures.,1,negative,2025-11-11,True
4355,11,Trouser,"Got this trouser as a backup. It's decent, not amazing. It's good for the price point.",2,negative,2025-10-17,True
110,926,Sandal,Amazing quality for the price. This sandal is superb! This is my third purchase from ShopSmart and this sandal doesn't disappoint. Looks even better in person.,5,positive,2025-11-08,True
47,405,Sandal,The sandal is neither great nor terrible. Just average.,5,positive,2025-11-20,True
103,1532,Sneaker,Amazing quality for the price. This sneaker is stunning!!!,4,positive,2025-11-03,True
2564,1975,Bag,Bought this bag on a whim and it's become my favorite piece. Love the texture. This bag exceeded my expectations. Love the texture. 5 stars!,5,positive,2026-01-14,True
1140,1974,Dress,"Perfect dress! True to size, great material, beautiful color. Price is a bit steep but worth it.",3,positive,2025-09-22,True
3126,1083,Shirt,I bought this shirt for a work and had to return it because Multiple loose threads everywhere.. Second time ordering from ShopSmart and second time being disappointed with this shirt.,2,negative,2025-09-26,True
2653,1906,Shirt,Amazing quality for the price. thsi shirt is excellent!  Color is slightly different than shown.,5,positive,2025-11-13,False
2436,1724,Bag,Five stars. This bag is gorgeous adn I ordered two more.,5,positive,2026-01-02,False
2357,1043,Pullover,Love tihs pullover! Love the texture. Would definately buy again.,5,positive,2025-10-17,True
1709,988,Pullover,Finally found a pullover that actually looks like the pictures. Worth every penny.,5,positive,2026-01-24,True
2077,411,Pullover,The quality is acceptable for a pullover at this price point. The color is a bit different than expected.,4,positive,2026-01-09,True
4284,1727,Bag,Had high hopes but this bag is really low quality. Quality is NOWHERE near the pictures.,1,negative,2026-01-15,True
3368,827,Bag,Sizing is completely off nad the material is terrible. Returning this bag. ,1,negative,2026-01-30,True
