review_id,customer_id,product_category,review_text,star_rating,sentiment,review_date,verified_purchase
2649,346,Dress,This dress was a great find. Didn't expect it to be this nice.,5,positive,2025-09-16,True
883,212,Sneaker,ShopSmart knocked it out of the park with this sneaker. amazing! ,5,positive,2025-12-01,True
1194,1282,Bag,"Wore this bag a few times. It's fine, nothing special.",4,positive,2025-11-19,False
4777,238,Trouser,Wore this trouser to a wedding and got so many compliments. lovely!,2,neutral,2026-01-06,True
5089,144,Sandal,This sandal is serviceable. The color is a bit different than expected. Would consider alternatives next time.,4,neutral,2025-11-27,True
2889,530,Dress,Second time ordering from ShopSmart and second time being dissapointed with this dress.,2,negative,2026-01-07,True
2976,682,Bag,My partner got this for me and I'm honestly embarrassed to wear it. Multiple loose threads everywhere.,2,negative,2026-03-13,True
4529,1204,Coat,I've seen worse and I've seen better. This coat is right in the middle. ,3,neutral,2026-01-31,True
4454,1765,Pullover,The sizing is way off. Ordered my usual size but this pullover hangs like a tent. ,1,negative,2026-02-24,True
4571,17,Trouser,Waited two weeks for this trouser nad it arrived missing buttons.,4,neutral,2026-02-25,False
749,857,Bag,I'd give this bag a solid B minus.,5,positive,2025-09-27,True
5308,112,Sandal,The quality is acceptable for a sandal at this price point. I've had it for a week and it's holding up.  The sandal does its job. Would I recommend it? Maybe.,2,neutral,2025-10-12,False
1497,1265,Pullover,This pullover is a STAPLE now. I wear it constantly. ,5,positive,2025-10-02,True
5540,470,Shirt,"For the price, this shirt is reasonable. Don't expect luxury though.",2,neutral,2025-09-27,True
792,733,Coat,Solid purchase. The coat holds up really well after multiple washes. Bought this coat on a whim and it's become my favorite piece. The design is so elegant.,3,neutral,2025-11-17,True
1910,86,Sandal,I've seen worse and I've seen better. This sandal is right in the middle.,4,positive,2026-02-14,True
3748,1222,Ankle Boot,Second time ordering from ShopSmart and second time being disappointed with this ankle boot.,3,negative,2026-02-08,False
3841,1012,T-shirt,Looked great online but in person this t-shirt is a disaster. ,1,negative,2025-11-27,True
4451,987,Bag,The bag is neither great nor terrible. Just average.  Style is cute but that's about it.,2,negative,2025-09-23,False
5689,1968,T-shirt,The material on tihs t-shirt feels so premium. perfect quality all around.,4,neutral,2025-10-14,True
6000,120,Ankle Boot,"Got this ankle boot as a backup. It's decent, not amazing. The color is a bit different than expected. Some things I like, some I don't.",3,neutral,2026-01-03,True
308,485,Trouser,Five stars. This trouser is top-notch and I ordered two more.,4,positive,2025-12-04,True
5317,1737,T-shirt,The t-shirt looks good BUT the material is thinner than expected. Overall it's alright.,3,neutral,2026-03-05,True
2479,1305,Ankle Boot,Super comfortable ankle boot. Great for everyday wear. Not the softest material but looks great.,5,positive,2026-01-01,False
2833,1438,Coat,My husband got this for me and I'm honestly embarrassed to wear it. The elastic stretched out immediately.,3,negative,2026-01-11,True
5712,940,Ankle Boot,"It's an average ankle boot. Material is thinner than I expected. Might keep it, might return it. My friend loved it but I'm not sure.",3,neutral,2025-11-20,True
206,787,Trouser,Really pleased with how this trouser turned out. lovely.,5,positive,2026-01-17,True
2801,1790,Trouser,Not worth the money at all. The trouser feels like it'll fall apart any day... Style is cute but that's about it.,1,negative,2026-02-10,False
2713,1867,Ankle Boot,The quality just isn't there. This ankle boot feels flimsy and looks worse. The color was accurate to the picture. Looked great online but in person this ankle boot is a disaster.,1,negative,2025-12-07,False
2111,1060,Shirt,It fits fine and looks okay. The shirt is nothing to write home about though.,5,neutral,2026-03-15,True
2331,416,Dress,th dress works for what I need. Wouldn't rave about it though.,5,positive,2026-02-19,True
3324,447,Pullover,My son got this for me and I'm honestly embarrassed to wear it. Fabric feels like sandpaper. ,2,negative,2026-02-08,False
2844,1346,Pullover,Do not buy this pullover. The fit is completely wrong. Complete waste of money. ,1,negative,2026-01-28,False
2972,895,Trouser,My son got tihs for me and I'm honestly embarrassed to wear it. Material started pilling right away.,3,negative,2026-02-08,True
772,1652,Sandal,The quality is acceptable for a sandal at thsi price POINT. It's comfortable enough.,4,positive,2026-01-22,True
5911,280,T-shirt,The t-shirt works for what I need. Wouldn't rave about it though.,3,neutral,2025-10-08,True
4092,1670,Bag,"Middle of the road bag. Some good aspects, some meh. ",1,negative,2025-12-25,True
4619,187,Ankle Boot,The fit on tihs ankle boot is spot on. No complaints.,3,neutral,2026-01-04,True
2488,1366,Pullover,Just what I needed. hte pullover is comfortable and looks sharp.,5,positive,2025-10-02,False
4169,1786,Pullover,Looked great online but in person this pullover is a disaster...,2,negative,2025-11-17,True
394,157,Pullover,Just what I needed.,4,positive,2025-09-30,True
5127,1179,Dress,This dress is serviceable. Nothing wrong with it really. Would consider alternatives next time.,2,neutral,2025-12-04,True
2932,1330,Sneaker,Terrible quality. The sneaker developed holes after just one wash. ,2,negative,2025-12-19,False
1560,122,Shirt,The shirt does its job. Would I recommend it? Maybe.,5,positive,2026-01-08,True
5577,1771,Dress,"For teh price, this dress is reasonable. Don't expect luxury though.",4,neutral,2025-12-23,True
3272,681,Sneaker,This sneaker is cheaply made. The zipper broke on the first use. Expected much better from ShopSmart. ,1,negative,2025-12-22,True
471,1233,Coat,So perfect! The coat fits perfectly and the color is vibrant.,4,positive,2025-09-26,True
3025,355,Ankle Boot,This ankle boot is cheaply made. Quality is nowhere near the pictures. Expected much better FROM ShopSmart.,2,negative,2026-01-25,True
5325,580,T-shirt,An okay purchase. The t-shirt has both pros and cons.,3,neutral,2026-03-05,True
5446,5,T-shirt,"Wore this t-shirt a few times. It's fine, nothing special. ",2,neutral,2025-12-18,True
3177,1428,Sneaker,Really uncomfortable sneaker. Couldn't wear it for more than an hour.,2,negative,2026-03-11,True
5980,894,T-shirt,I've seen worse and I've seen better. This t-shirt is right in the middle.,3,negative,2025-11-17,True
3777,330,Dress,Can't even give this dress away. That's how bad it is.,3,negative,2026-02-08,True
5098,489,Bag,The bag works for what I need. Wouldn't rave about it though.,4,neutral,2025-09-29,True
3750,1548,Pullover,Can't even give this pullover away. That's how bad it is.,1,negative,2026-01-14,True
1411,1720,Ankle Boot,The ankle boot is neither great nor terrible. Just average.,3,positive,2025-10-01,True
4246,1770,Trouser,Returned this trouser immediately. There was a hole in the seam. Very unhappy. ,2,negative,2025-12-26,True
2968,603,Dress,Second time ordering from ShopSmart and second time being disappointed with this dress.,1,neutral,2026-02-06,False
1749,1862,Trouser,I've seen worse and I've seen better. This trouser is right in the middle. ,5,positive,2025-09-20,False
193,1063,Trouser,"For the price, this trouser is reasonable. Don't expect luxury though. Shipping took a while though.",5,positive,2025-11-17,True
2240,1876,Pullover,Solid purchase. The pullover holds up really well after multiple washes.,4,positive,2025-12-17,False
1611,1189,Shirt,ShopSmart knocked it out of the park with this shirt. outstanding!,3,positive,2026-02-09,True
2783,52,Sneaker,The sizing is way off. Ordered my usual size but this sneaker barely fits even though I sized up. ,1,negative,2026-03-12,False
390,1843,Coat,This coat is perfect for spring. Looks great and feels comfortable. ,5,positive,2026-02-21,True
2406,1318,Sandal,Can't believe how top-notch this sandal is for the price. Seriously impressed.  Minor thread issue but nothing major.,5,positive,2025-10-26,False
5684,1683,Trouser,You get what you pay for with this trouser. Nothing wrong with it really. The trouser works for what I need. Wouldn't rave about it though.,3,neutral,2025-10-08,True
4492,1306,Bag,Can't believe this bag passed quality control. It smells like chemicals...,1,negative,2026-01-31,True
4006,1386,Dress,The color of this dress is completely different from what's shown.,1,negative,2025-10-05,True
1421,697,Coat,Wore this coat to a date night and got so many compliments. fantastic! Shipping took a while though.,5,positive,2025-09-22,False
3787,1962,Sneaker,The sneaker is okay.,3,negative,2026-02-19,True
46,943,T-shirt,It fits fine and looks okay. The t-shirt is nothing to write home about though. Shipping took a while though. My new favorite t-shirt. Wore it all weekend.,4,positive,2026-02-21,False
5905,858,Sandal,I've seen worse and I've seen better. This sandal is right in the middle.,4,neutral,2025-09-16,True
5816,1704,Pullover,I've seen worse and I've seen better. This pullover is right in th middle.,2,neutral,2025-12-14,True
2320,1245,Trouser,Really good trouser. Bought one for myself adn one as a gift.,5,neutral,2026-03-07,True
4674,1118,Sneaker,Decent enough sneaker for casual wear. Not for anything special.,2,neutral,2025-10-31,True
4271,555,Dress,It FITS fine and looks okay.,3,negative,2026-02-27,True
5268,1266,Sandal,The quality is acceptable for a sandal at this price point. It's comfortable enough.,4,neutral,2025-10-13,True
3218,103,Ankle Boot,Expected so much more from this ankle boot. Really let down. ,2,negative,2026-01-03,False
795,1290,T-shirt,Ordered this t-shirt last week and already want another color.,5,positive,2026-01-24,False
5021,1475,Ankle Boot,I've seen worse and I've seen better. This ankle boot is right in the middle. My friend loved it but I'm not sure.,2,neutral,2026-02-28,True
5067,1848,Coat,Passable coat. My expectations were met but not exceeded.,3,neutral,2026-02-23,False
4150,1466,Sandal,Really uncomfortable sandal. Couldn't wear it for more than an hour.,1,negative,2025-10-21,True
501,1430,Ankle Boot,This ankle boot is perfect for spring. Looks great and feels comfortable.,5,positive,2025-12-17,True
4214,769,Trouser,Terrible qualiy. teh trouser the color bled everywhere after just one wash.,1,negative,2026-02-21,True
4844,1804,Pullover,hte pullover is fine for the price. Shipping took a while though.,3,neutral,2026-02-10,False
5500,1415,Trouser,You get WHAT you pay for with this trouser.,3,neutral,2025-10-26,True
2322,898,Pullover,Really good pullover. Bought one for myself and one as a gift.,5,positive,2026-03-12,False
4977,1100,Sneaker,Finally found a sneaker that actually looks like the pictures. Worth every penny.,2,neutral,2026-02-13,True
889,529,Ankle Boot,Bought this ankle boot on a whim and it's become my favorite piece. Love the texture.  Got tons of compliments on this ankle boot. Will order again.,5,positive,2025-11-06,True
2373,1389,Dress,tihs dress exceeded my expectations. The quality is outstanding. 5 stars! ,4,positive,2026-02-23,True
365,228,T-shirt,The t-shirt looked exactly like the photo. Very happy with it.,5,positive,2025-10-12,True
493,1314,Shirt,Highly recommend this shirt. Great attention to detail. You won't be disappointed. ,5,positive,2025-10-25,True
4034,354,Sandal,"After wearing this sandal once, developed holes. Extremely poor quality.",3,negative,2026-02-18,True
5747,1361,Ankle Boot,The quality is acceptable for a ankle boot at this price point. It's comfortable enough.,2,neutral,2025-10-03,True
5053,1811,Dress,"Got this dress as a backup. It's decent, not amazing. The packaging was nice at least.",2,neutral,2026-01-12,True
3524,726,Bag,The bag is fine for the price.,1,negative,2025-09-19,False
2076,652,Ankle Boot,"Perfect ANKLE boot! True to size, great material, top-notch color. Shipping took a while though.",3,positive,2026-03-12,True
1597,884,T-shirt,Amazing quality for the price. This t-shirt is gorgeous!,4,positive,2025-10-30,False
4941,1672,Shirt,Pleasantly surprised by tihs shirt. Expected less for the price. My friend loved it but I'm not sure.,3,neutral,2025-09-29,True
4602,214,Shirt,Would consider buying this shirt again if it went on sale. Nothing wrong with it really. ,3,neutral,2025-12-25,True
329,1079,Pullover,Just what I needed. The pullover is comfortable and looks sharp...,3,positive,2025-10-30,True
3011,689,Trouser,This trouser is serviceable. Nothing wrong with it really. Would consider alternatives next time. Style is cute but that's about it. Had high hopes but this trouser is really low quality. Stitching was already coming undone.,2,negative,2026-01-11,True
4030,897,Shirt,This shirt is cheaply made. The material feels cheap adn thin. Expected much better from ShopSmart. ,2,negative,2025-10-21,True
1389,176,Pullover,Finally found a pullover that actually looks like the pictures. Shipping was fast too.,4,positive,2025-11-16,True
1980,677,T-shirt,"Wore this t-shirt a few times. It's fine, nothing special. Great t-shirt, exactly what I was looking for. Perfect for everyday wear.",5,positive,2025-12-29,True
1487,60,Trouser,No issues at all WITH this trouser. Quality is solid. ,3,positive,2026-01-12,True
1978,1369,Bag,This bag is a staple now. I wear it constantly.,4,positive,2026-02-20,True
3119,1455,T-shirt,Tried to make it work but this t-shirt is just bad. Multiple loose threads everywhere.,3,negative,2026-03-12,True
5566,1927,Shirt,The stitching on this shirt is terrible. Material started pilling right away. Looks like a knockoff.,3,neutral,2026-01-28,False
1214,690,Dress,Got this dress for my sister and they absolutely love it. Perfect for everyday wear.,5,positive,2025-10-06,False
1000,571,Pullover,"Perfect pullover! True to size, great material, excellent color.",5,positive,2025-12-27,True
5655,500,Coat,"Save your money and skip this coat. The zipper broke on the first use.  For the price, this coat is reasonable. Don't expect luxury though.",3,neutral,2026-01-18,True
5358,1627,Bag,I've bought better bags at the dollar store honestly. The zipper broke on the first use.,3,neutral,2025-12-26,True
68,1788,Sneaker,A+ quality. This sneaker feels like it should cost twice as much.,4,positive,2026-01-14,False
3543,1995,Trouser,Tried to make it work but this trouser is just bad. It smells like chemicals.,1,negative,2025-12-06,True
5156,1627,Shirt,This shirt is serviceable. Not sure if I'd buy it again. Would consider alternatives next time.,3,neutral,2025-10-14,False
1824,1918,Sandal,Just what I needed. th sandal is comfortable and looks sharp. The packaging could have been better.,5,positive,2026-03-06,True
1912,315,Sneaker,"Middle of the road sneaker. Some good aspects, some meh. ",5,positive,2026-02-25,False
5947,1555,Dress,"Not bad, not great. The dress is exactly what you'd expect for this price.",3,neutral,2025-09-30,True
3331,1073,Shirt,Very disappointed with this shirt. Material started pilling right away. Would not recommend. Shipping was fast though.,2,negative,2025-10-02,True
54,867,T-shirt,This t-shirt was a great find. Didn't expect it to be this nice...,4,positive,2026-01-29,True
952,560,T-shirt,"Middle of the road t-shirt. Some good aspects, some meh. Color is slightly different than shown.",4,positive,2025-11-07,True
1260,1629,Coat,The coat arrived fast and looks even better in person. Color is exactly as shown.,4,neutral,2025-10-29,False
4722,347,Coat,"Passable coat. My expectations were met but not exceeded.  Some things I like, some I don't.",3,neutral,2025-12-30,False
3496,106,Ankle Boot,One of the worst online PURCHASES I've ever made. This ankle boot is awful.,1,negative,2026-02-15,True
3846,512,T-shirt,One of the worst online purchases I've ever made. This t-shirt is awful. ,3,negative,2025-12-19,True
3711,1154,Coat,I baught this coat for a a wedding and had to return it because Quality is nowhere near the pictures..,2,negative,2025-11-04,True
800,359,Pullover,The pullover is neither great nor terrible. Just average.,5,positive,2026-02-09,True
2704,351,Trouser,One of the worst online purchases I've ever made. tihs trouser is awful. The color was accurate to the picture.,3,neutral,2025-11-10,True
4091,1348,Bag,Average bag. I don't love it but I don't hate it.,1,negative,2025-11-10,False
1200,1766,Sandal,Got this sandal for my son and they absolutely love it. Very versatile piece. ,5,positive,2026-01-16,False
1820,1121,Ankle Boot,Got tons of compliments on this ankle boot. Will order again.,5,positive,2026-01-13,True
4423,1570,Bag,The stitching on this bag is terrible. The fit is completely wrong. Looks like a knockoff.,3,negative,2025-10-01,True
5006,1684,Trouser,I've seen worse and I've seen better. This trouser is right in the middle.,3,neutral,2025-12-20,True
4935,491,Sneaker,The sneaker does its job. Would I recommend it? Maybe.,3,neutral,2026-01-13,True
1426,1118,Sandal,My new favorite sandal. Wore it all weekend.,5,positive,2026-02-07,False
913,1369,Sandal,Been looking for a sandal like this forever. So glad I found it. ,3,positive,2026-03-14,True
2550,104,Sandal,Ordered this sandal last week and already want another color.,5,positive,2025-10-14,True
773,105,Trouser,ShopSmart knocked it out of the park with this trouser. superb!,5,positive,2025-12-27,True
3682,978,Coat,Decent enough coat for casual wear. Not for anything special.,2,negative,2026-01-08,False
1375,1266,Pullover,"Great pullover, exactly WHAT I was looking for. amazing attention to detail.",5,positive,2026-02-10,True
5552,1938,Sneaker,I'd give this sneaker a solid B minus. Gets the job done.,4,negative,2025-12-25,True
3951,97,Coat,Uncomfortable and poorly designed. This coat is not worth your money.,1,negative,2025-10-04,False
1504,159,Shirt,Finally found a shirt that actually looks like the pictures.,5,positive,2026-02-22,False
5986,1662,T-shirt,An okay purchase. The t-shirt has both pros and cons.,3,neutral,2026-03-09,True
4180,878,T-shirt,Average t-shirt. I don't love it but I don't hate it.,1,negative,2026-02-13,True
737,446,Pullover,Got tons of compliments on this pullover.,5,positive,2026-01-29,True
2587,1384,Pullover,I'm obsessed with this pullover. The quality is lovely. Already ordered another one. Color is slightly different than shown.,3,positive,2025-10-26,False
1163,605,Coat,No issues at all with this coat. Quality is solid.,3,positive,2026-01-07,True
2701,738,Bag,I'd give this bag a solid B minus. Gets the job done.,1,negative,2025-12-21,True
1677,1229,Coat,Really pleased with how this coat turned out.,5,positive,2026-03-04,True
1074,3,T-shirt,Can't believe how amazing this t-shirt is for the price. Seriously impressed.,3,positive,2025-11-14,True
5121,1190,Coat,The qualiy is acceptable for a coat at this price point. The packaging was nice at least.,2,negative,2026-03-02,False
3104,337,Trouser,Wasted my money on this trouser. Should have read the reviews first. ,1,negative,2025-10-22,True
1323,179,Coat,Solid purchase. The coat holds up really well after multiple washes. Shipping took a while though.,4,positive,2025-12-23,True
1063,1371,Dress,Solid purchase. The dress holds up really well after multiple washes.,5,positive,2026-02-04,False
4064,1293,Dress,"Middle of the road dress. Some good aspects, some meh.",2,negative,2025-10-24,True
5458,1546,Dress,This dress is serviceable. It's good for the price point. Would consider alternatives next time.,2,neutral,2025-09-16,True
2410,1359,Dress,"Perfect dress! True to size, great material, gorgeous color. ",5,positive,2026-01-05,True
330,1052,Coat,This coat is a staple now. I wear it constantly.,5,positive,2026-03-10,True
1966,282,Trouser,Wore this trouser to a job interview and got so many compliments. stunning!,5,positive,2025-12-11,True
838,669,T-shirt,I've seen worse and I've seen better. tihs t-shirt is right in the middle.  The packaging could have been better.,5,positive,2026-02-14,True
2131,500,Coat,My new favorite coat. Wore it all weekend.,5,positive,2025-11-13,False
3569,1943,Sneaker,Looked great online but in person this sneaker is a disaster.,2,negative,2025-11-23,True
706,600,Trouser,"Comfortable, stylish, and well-made. This trouser checks all the boxes. ",5,positive,2026-01-11,True
1009,932,Sandal,Super comfortable sandal. Great for everyday wear.,4,positive,2026-01-12,False
2979,1407,Coat,Second time ordering from ShopSmart nad second time being disappointed with this coat...,1,negative,2025-12-23,True
2936,1280,Trouser,This trouser runs super tight and the material is scratchy. CAN'T wear it.  The trouser started the print started peeling within a week. Absolute garbage.,2,negative,2025-12-04,True
307,352,Bag,"comfrotable, stylish, and well-made. tihs bag checks all the boxes. ",4,positive,2026-02-08,True
4776,183,Sandal,Average sandal.,2,neutral,2026-02-13,True
1333,1094,T-shirt,Would consider buying this t-shirt again if it went on sale. The color is a bit different than expected...,5,positive,2025-12-23,True
2246,773,T-shirt,Can't believe how beatiful this t-shirt is for the price. Seriously impressed. ,4,positive,2025-12-10,True
1414,688,Coat,Pleasantly surprised by this coat. Expected less for the price.,4,positive,2025-10-18,True
5642,933,Dress,My new favorite dress. Wore it all weekend. ,3,neutral,2025-12-02,False
3502,267,Trouser,I've seen worse and I've seen better. This trouser is right in the middle.,3,negative,2026-01-26,True
1918,311,Shirt,"Perfect shirt! True to size, great material, perfect color.",5,positive,2026-01-16,True
163,513,Bag,Really pleased with how this bag turned out. perfect.,4,positive,2026-02-10,True
2443,975,Coat,So stunning! The coat fits perfectly and the color is vibrant.,4,positive,2025-10-14,True
5076,352,Pullover,Average pullover. I don't love it but I don't hate it. ,2,positive,2026-01-07,True
4862,949,T-shirt,It fits fine and looks okay. The t-shirt is nothing to write home about though. Hard to decide if I should keep it.,2,neutral,2026-03-08,True
3851,486,Pullover,Uncomfortable and poorly designed. This pullover is not worth your money. ,2,negative,2026-02-07,False
5683,1931,Sneaker,One of the worst online purchases I've ever made. This sneaker is awful.,2,neutral,2025-09-27,True
1658,1720,Shirt,My new favorite shirt.,5,positive,2025-12-05,True
3826,1431,T-shirt,Expected so much more from this t-shirt. Really let down.,3,negative,2026-01-18,False
1822,1826,Sandal,"Perfect sandal! True to size, great material, excellent color.",5,positive,2026-03-06,True
3262,120,Bag,Second time ordering from ShopSmart and second time being disappointed with this bag.,1,negative,2025-10-12,False
170,259,Coat,Great coat for the price point. Worth every penny. Minor thread issue but nothing major. Great coat for the price point. Looks even better in person.,5,positive,2026-02-23,True
3859,330,Trouser,Decent enough trouser for casual wear. Not for anything special.,3,negative,2026-01-30,True
396,44,Bag,The material on this bag feels so premium. excellent quality all around. The packaging could have been better.,5,positive,2025-10-15,True
5818,1211,Pullover,Passable pullover. My expectations were met but not exceeded. ,2,neutral,2025-10-21,True
2813,1158,Coat,The sizing is way off. Ordered my usual size but tihs coat is enormous on me.,2,negative,2025-09-23,True
3521,1962,Dress,Returned thsi dress immediately. The zipper broke on the first use. Very unhappy.,1,negative,2026-02-09,True
503,1700,Shirt,"Great shirt, exactly what I was looking for.",5,positive,2025-12-02,False
3556,514,Dress,"After wearing this dress once, started falling apart. Extremely poor quality. Uncomfortable and poorly designed. This dress is not worth your money.",1,negative,2026-01-31,True
3009,886,Dress,This dress is a three out of five for me. Nothing wrong with it really.  Shipping was fast though.,3,negative,2025-11-09,True
3304,441,Dress,Waited two weeks for this dress and it arrived missing buttons.,2,negative,2025-09-19,False
2371,1687,Pullover,No issues at ALL with this pullover. Quality is solid.,5,positive,2026-02-09,True
215,1065,Coat,The coat is neither great nor terrible. Just average. ,5,positive,2025-11-04,True
1687,1295,Dress,Bought this dress on a whim and it's become my favorite piece. The design is so elegant.,5,positive,2025-12-25,True
176,123,Dress,My new favorite dress. Wore it all weekend... Price is a bit steep but worth it.,4,positive,2025-10-01,True
3164,106,Pullover,"After wearing this pullover once, started falling apart. Extremely poor quality.",1,negative,2026-01-09,True
3641,246,T-shirt,Sizing is completely off and the material is terrible. Returning this t-shirt.,2,negative,2025-11-02,True
5370,1935,Coat,Wore this coat to work and got so many compliments. amazing!,2,neutral,2026-02-06,True
1468,527,Pullover,Amazing quality for the price. This pullover is incredible!,4,positive,2025-12-19,True
3027,628,Coat,"Not bad, not great. teh coat is exactly what you'd expect for this price.",1,negative,2026-02-17,False
574,175,T-shirt,The t-shirt looks good but it wrinkles easily. Overall it's alright.,5,positive,2025-10-26,True
4204,1316,Sneaker,The qualiy is acceptable for a sneaker at this price point. Sizing runs slightly large. ,1,negative,2025-11-29,True
4668,715,Sandal,Really uncomfortable sandal.,2,neutral,2026-01-04,True
4311,589,Trouser,Really uncomfortable trouser.,3,negative,2026-03-12,True
1640,1568,Dress,"Comfortable, stylish, and well-made.",3,positive,2025-11-12,True
4144,1445,Sandal,Sizing is completely off and the material is terrible. Returning this sandal.,2,negative,2025-10-08,True
